{
  "authorityBindings": {
    "baselineReportDigest": "3ea8d00bd2fe09afe23d1989f14d3385d392b515b33ad5c3fd264db69ba7e3d7",
    "baselineReportVersion": "retrieval-baseline-report/2.0.0",
    "corpusSemanticDigest": "2e76715d952b84f3eb124c662ecb0b43acbbe98df1ad5f63b366d5f393a2f84e",
    "corpusVersion": "retrieval-evaluation-corpus/2.0.0",
    "independentReviewDigest": "78f7cbfbf2f2ce0651ee03a9473961cf56f6370100f838fee8cf14ca9fae2892",
    "independentReviewVersion": "retrieval-relevance-independent-review/1.0.0",
    "relevanceVersion": "retrieval-relevance-gold/2.0.0",
    "scorerVersion": "retrieval-evaluation-scorer/1.0.0"
  },
  "gates": {
    "exactCorrectness": {
      "hardFilter": {
        "denominator": 4500,
        "numerator": 4500
      },
      "noEligible": {
        "denominator": 30,
        "numerator": 30
      },
      "prohibitedPreservation": {
        "denominator": 15,
        "numerator": 15
      }
    },
    "familyRecallAt10": [
      {
        "derivation": "0.90-times-reviewed-v2-family-ceiling",
        "family": "authorization",
        "floor": 0.603529
      },
      {
        "derivation": "0.90-times-reviewed-v2-family-ceiling",
        "family": "audit-logging",
        "floor": 0.493043
      },
      {
        "derivation": "0.90-times-reviewed-v2-family-ceiling",
        "family": "background-jobs",
        "floor": 0.428276
      },
      {
        "derivation": "0.90-times-reviewed-v2-family-ceiling",
        "family": "rate-limiting",
        "floor": 0.480001
      },
      {
        "derivation": "0.90-times-reviewed-v2-family-ceiling",
        "family": "webhooks",
        "floor": 0.733847
      }
    ],
    "macroRecallAt10": 0.608599,
    "maximumViolations": {
      "controlledEquivalenceDuplicates": 0,
      "exactDuplicates": 0,
      "hardConflictResults": 0,
      "lane": 0,
      "negativeControl": 0
    },
    "meanReciprocalRank": 0.9,
    "ndcgAt10": 0.75,
    "positiveCaseHitRate": {
      "denominator": 25,
      "numerator": 25
    }
  },
  "macroTransfer": {
    "baselineTarget": 0.60859904,
    "ceilingRelativeTarget": 0.5796188527399861,
    "publishedGate": 0.608599,
    "selectedTarget": 0.60859904
  },
  "qualityGateVersion": "retrieval-quality-gates/1.0.0",
  "saturationProof": {
    "allPositiveCasesSaturated": true,
    "positiveCases": 25,
    "proofDigest": "7d6322ba1378eaaff2f1ee18207080d470cd3586b3c674aa3d186d64e7cc58f9",
    "proofVersion": "retrieval-ceiling-saturation-proof/1.0.0",
    "saturatedCases": 25
  },
  "semanticDigest": "be500a5b9b58f1911659e050653f80e122695c83d083b9c9767421c61269b18c",
  "strongestOrdinaryBaseline": {
    "baselineId": "alias-expanded",
    "baselineVersion": "retrieval-alias-expanded-baseline/1.0.0",
    "macroRecallAt10": 0.608599,
    "predictionSetDigest": "b91c951d0131fe8bbd8fc1fdf95157d3c1244b5bc8bdf4046dba663a1df15629",
    "rawMacroRecallAt10": {
      "denominator": 390625,
      "numerator": 237734,
      "value": 0.60859904
    },
    "scoreReportDigest": "15b63b5d0aad13090a962a297bffc477ab0e8e9f3218066894c5c998daff3b4f"
  },
  "theoreticalCeilings": {
    "families": [
      {
        "ceiling": 0.670588,
        "family": "authorization"
      },
      {
        "ceiling": 0.547826,
        "family": "audit-logging"
      },
      {
        "ceiling": 0.475862,
        "family": "background-jobs"
      },
      {
        "ceiling": 0.533334,
        "family": "rate-limiting"
      },
      {
        "ceiling": 0.815385,
        "family": "webhooks"
      }
    ],
    "macroRecallAt10": {
      "denominator": 2211105,
      "numerator": 1345676,
      "published": 0.608599,
      "value": 0.6085988679868211
    },
    "microRecallAt10": {
      "denominator": 433,
      "numerator": 209,
      "published": 0.482679,
      "value": 0.48267898383371827
    }
  },
  "thresholdReview": {
    "correctedTransfer": {
      "historicalCeilingFraction": {
        "denominator": 656249,
        "numerator": 625000,
        "value": 0.9523824036303293
      },
      "rule": "maximum-of-ceiling-relative-and-strongest-baseline"
    },
    "firstTransferAttempt": {
      "historicalMargin": 0.012705,
      "outcome": "infeasible-above-theoretical-ceiling",
      "resultingTarget": 0.621304,
      "rule": "baseline-plus-historical-absolute-margin",
      "stoppedBeforeProductionV2Score": true
    }
  }
}
